<?xml version="1.0" encoding="UTF-8"?>
<csdb xmlns="http://www.s1000d.org/csdb"
      xmlns:xsi="http://www.w3.org/2001/XMLSchema-instance"
      xsi:noNamespaceSchemaLocation="../schemas/csdb.xsd">
  <csdbIdent>
    <csdbCode>BWQ1-ATA57-CSDB</csdbCode>
    <issueInfo issueNumber="001" inWork="00"/>
  </csdbIdent>
  <repositories>
    <repository type="data_modules" path="../data_modules/"/>
    <repository type="publication"  path="../publication_modules/"/>
    <repository type="common"       path="../common_information/"/>
    <repository type="multimedia"   path="../multimedia/"/>
    <repository type="indices"      path="../indices/"/>
    <repository type="exchange_in"  path="../exchange/incoming/"/>
    <repository type="exchange_out" path="../exchange/outgoing/"/>
  </repositories>
</csdb>